{
    "path": "data/dataset_CV/CV/1.docx",
    "text": " 自我评价本人性格开朗、稳重、有活力，待人热情、真诚。有较强的组织能力、团体协作精神，较好的社交能力，善于处理各种人际关系。 能迅速的适应各种环境，并融合其中。能把企业当作家庭，企业 的财富就是我的财富，在努力为企业服务的过程中实现自身价值。138 9999 9999 张吉惟 求职意向：行政管理类 zhangjiwei@163.com   工作经历 基本信息出生年月：1998.11 2022.3至今 部长助理 性    别：女 北京猫眼机械有限公司 籍    贯：北京海淀区 质管部部长助理.负责票证车间生产质量检查,控制,兼学    历：本科 任企业内审员,推行ISO9001:2008及ISO14000体系并政治面貌：党员 年审。 身    高：178cm 2021.2-2022.3 总经理助理 体    重：50kg 北京猫眼国际货运代理有限公司 根据公司的经营理念和发展战略制定公司各工作岗位的工作目标;负责制定及推进公司员工的培训、绩效、 个人技能薪酬的管理。 2020.2-2021.2 运营助理 EXCEL 北京猫眼文化传媒有限公司 PPT 根据目标管理综合考评内容，深入、细致地到所跟踪的WORD 各场所了解、掌握情况，帮助和促进各场所提高行政、AI 后勤管理水平。 PS  教育背景 个人爱好2015-2019 国际经济与贸易 北京师范大学 政治经济学、西方经济学、国际经济学、计量经济学、世界经济概论、国际贸易理论与实务、国际金融、国际结算。  奖励证书2016 全国大学生英语竞赛一等奖 2017 国家级一等奖学金 2018 大学英语6级证书（CET-6） ",
    "token": {
        "ner": [
            "人物",
            "学校",
            "工作单位"
        ],
        "information": {
            "人物": [
                "性别",
                "出生日期",
                "年龄",
                "职务",
                "电话",
                "邮箱",
                "学历"
            ],
            "学校": [
                "学历",
                "专业",
                "时间",
                "时间段"
            ],
            "工作单位": [
                "职务",
                "时间",
                "时间段"
            ]
        }
    },
    "result": {
        "ner": {
            "人物": [
                "张吉惟"
            ],
            "学校": [
                "北京师范大学"
            ],
            "工作单位": [
                "北京猫眼机械有限公司",
                "北京猫眼国际货运代理有限公司"
            ]
        },
        "information": {
            "张吉惟": {
                "性别": [
                    "女"
                ],
                "出生日期": [
                    "1998.112022.3"
                ],
                "年龄": [
                    "13899999999",
                    "1998.11"
                ],
                "职务": [
                    "部长助理"
                ],
                "电话": [
                    "13899999999"
                ],
                "邮箱": [
                    "zhangjiwei@163.com"
                ],
                "学历": [
                    "本科"
                ]
            },
            "北京师范大学": {
                "学历": [
                    "本科"
                ],
                "专业": [
                    "国际经济与贸易"
                ],
                "时间": [
                    "2021.2",
                    "2015",
                    "2019"
                ],
                "时间段": [
                    "2015-2019",
                    "2021.2-2022.3"
                ]
            },
            "北京猫眼机械有限公司": {
                "职务": [
                    "部长助理"
                ],
                "时间": [
                    "2022.3",
                    "1998.11"
                ],
                "时间段": [
                    "2022.3至今"
                ]
            },
            "北京猫眼国际货运代理有限公司": {
                "职务": [
                    "总经理助理"
                ],
                "时间": [
                    "2020.2",
                    "2021.2",
                    "2022.3"
                ],
                "时间段": [
                    "2021.2-2022.3"
                ]
            }
        }
    }
}