{
    "path": "data/dataset_CV/CV/13.docx",
    "text": "  RESUME 13800138000         出生日期：2002.10.3    广东省广州市   谢彦文  求职目标：市场总监-专注品牌   具备较强的团队管理和领导能力，优秀组织策划能力，曾带领过超20人以上 的团队，有大型市场推广活动的经验；善于发掘和培养人才，人才资源丰富。      教育背景  2017.09-2020.06                 广州市财经职业学校              市场营销（中专） 主修课程：管理学、微观经济学、宏观经济学、管理信息系统、统计学、会计学、财务管理、市场营销、经济法、消费者行为学、国际市场营销。 校内实践  2018.05-2019.06                  广州市财经职业学校                 辩论队（队长） 负责50余人团队的日常训练、选拔及团队建设； ⚫作为负责人对接多项商业校园行活动，如《奔跑吧兄弟》录制、《时代周末》校园行。 ⚫ 2017.11-2018.06                 沟通与交流协会                 创始人/副会长 协助沟通协会创立分部，从零开始组建初期团队； ⚫策划协会会员制，选拔、培训协会导师，推出一系列沟通课程。 ⚫工作经历  2022.10-至今                     辰鼎控股集团                副总监 负责协助集团旗下事业部开展各项工作，制定品牌传播方案； 结合集团与事业部发展，制定营销策略、广告策略、品牌策略和公关策略，并组织推进执行； 制定和执行媒体投放计划，跟踪和监督媒体投放效果，进行数据分析与撰写报告； 研究行业发展动态，定期进行市场调查,为产品更新提供建议。  2021.10-2022.10                 雅建有限公司                 市场及运营总监 根据公司发展情况进行战略调整，配合前端销售部门搭建销售渠道； 研究行业发展动态，定期进行市场调查,为产品更新提供建议； 负责公司部门(营运、品牌策划)制度规范，负责组织及监管市场部关于对外合作、推广策划以相关工作的落实。  2020.10-2021.10                 雄立俱乐部                   市场副总监 负责事业部产品对外推广和宣传，制定各种整合营销的活动； ⚫执行媒体投放计划，跟踪和监督媒体投放效果，进行数据分析撰写报告； ⚫向市场总监提供营销支持，并协助相关的公关事宜。 ⚫ 项目经历    雅建集团品牌升级发布会  集团全新品牌logo及VI上线，在多渠道进行了传播； ⚫ 企业VIP客户群体逾60人，结合了线上发布、线下体验； ⚫后续媒体报道持续升温，子品牌结合明星代言人制造话题营销，为期3周； ⚫ 雄立商业模式发布会 整场活动以会议+洽谈双重模式进行，首日以介绍雄立内部平台资源优势，政府背景优势等为主，一对多推介会进⚫行推广普及； 现场签署地方合作意向书，如：新疆、江西、浙江等优秀企业商户； ⚫以中国的波尔多为宣传点，主推旗下新疆大型项目，制造营销、品牌热点。 ⚫ 辰鼎投资控股集团6A自媒体生态圈建设 本项目重构了公司现有微信企业号的功能与架构。 ⚫提高公众号的关注粉丝量的同时，对于有客户进行统一宣传，统一管理。 ⚫奖项荣誉  2020年  财经职业学校 自强社“优秀社员” 2019年  三下乡”社会实践活动“优秀学生” 2019年  财经职业学校 学生田径运动会10人立定跳远团体赛第三名 2019年  学生军事技能训练“优秀学员” 2018年  财经职业学校 盼盼杯烘焙食品创意大赛优秀奖 2018年  财经职业学校学生主题征文一等奖 2017年  财经职业学校 微博文征集大赛二等奖 技能证书  普通话一级甲等 通过全国计算机二级考试，熟练运用office相关软件。 熟练使用绘声绘色软件，剪辑过各种类型的电影及班级视频。 大学英语四/六级（CET-4/6），良好听说读写能力，快速浏览英语专业书籍。 软件技能  PhotoShop                Illustrator                  Office                     绘声绘色 自我评价  拥有多年的市场管理及品牌营销经验，卓越的规划、组织、策划、方案执行和团队领导能力，积累较强的人际关系处理能力和商务谈判技巧，善于沟通，具备良好的合作关系掌控能力与市场开拓能力；敏感的商业和市场意识，具备优秀的资源整合能力、业务推进能力； 思维敏捷，有培训演讲能力，懂激励艺术，能带动团队的积极性；擅长协调平衡团队成员的竞争与合作的关系，善于通过培训提高团队综合能力和凝聚力。 ",
    "token": {
        "ner": [
            "人物",
            "学校",
            "工作单位"
        ],
        "information": {
            "人物": [
                "性别",
                "出生日期",
                "年龄",
                "职务",
                "电话",
                "邮箱",
                "学历"
            ],
            "学校": [
                "学历",
                "专业",
                "时间",
                "时间段"
            ],
            "工作单位": [
                "职务",
                "时间",
                "时间段"
            ]
        }
    },
    "result": {
        "ner": {
            "人物": [
                "谢彦文"
            ],
            "学校": [
                "广州市财经职业学校",
                "财经职业学校"
            ],
            "工作单位": [
                "辰鼎控股集团",
                "雅建有限公司",
                "辰鼎投资控股集团"
            ]
        },
        "information": {
            "谢彦文": {
                "性别": [],
                "出生日期": [
                    "2002.10.3"
                ],
                "年龄": [
                    "2002.10.3"
                ],
                "职务": [
                    "市场总监-专注品牌"
                ],
                "电话": [
                    "13800138000"
                ],
                "邮箱": [],
                "学历": [
                    "中专"
                ]
            },
            "广州市财经职业学校": {
                "学历": [
                    "中专"
                ],
                "专业": [
                    "市场营销"
                ],
                "时间": [
                    "2002.10.3",
                    "2019.06",
                    "2017.09",
                    "2020.06",
                    "2018.06",
                    "2017.11",
                    "2018.05"
                ],
                "时间段": [
                    "2017.09-2020.06",
                    "2018.05-2019.06"
                ]
            },
            "辰鼎控股集团": {
                "职务": [
                    "市场总监-专注品牌",
                    "副总监"
                ],
                "时间": [
                    "2022.10"
                ],
                "时间段": [
                    "2022.10-至今"
                ]
            },
            "雅建有限公司": {
                "职务": [
                    "市场及运营总监"
                ],
                "时间": [
                    "2021.10",
                    "2022.10",
                    "2020.10"
                ],
                "时间段": [
                    "2021.10-2022.10",
                    "2020.10-2021.10"
                ]
            },
            "财经职业学校": {
                "学历": [
                    "大学"
                ],
                "专业": [],
                "时间": [
                    "2020年",
                    "2018年",
                    "2017年"
                ],
                "时间段": [
                    "2020年",
                    "2018年",
                    "2017年"
                ]
            },
            "辰鼎投资控股集团": {
                "职务": [],
                "时间": [],
                "时间段": []
            }
        }
    }
}