{
    "path": "data/dataset_CV/CV/27.docx",
    "text": "李雅惠  设 计 师    基 本 信 息 联 系 信 息 姓名 奈森 13912341210 年龄 30岁 xianqi@taobao.com 籍贯 上海 上海浦东新区XX路 学历 本科 教 育 背 景 MS Office Adobe中国认证设计师 Photoshop 湖南大学 Adobe认证产品专家 Illustrator 平面设计师资格证书 平面设计 英语 平面设计师资格证书 2011-2015 日语 英语四六级证书 粤语 工 作 经 历 美铭顾问有限公司 职位：设计师  公司性质：私营企业  规模：50-100人 平面设计师 负责企业画册设计、标志设计、产品包装设计、杂志广告跨页设计、 2015.10-2016.10 ◼户外广告设计等。 智扬顾问有限公司 职位：设计师  公司性质：私营企业  规模：50-100人 平面设计师 负责企业画册设计、标志设计、产品包装设计、杂志广告跨页设计、 ◼2016.10-2018.10 户外广告设计等。 铭扬顾问有限公司 职位：设计师  公司性质：私营企业  规模：50-100人 平面设计师 负责企业画册设计、标志设计、产品包装设计、杂志广告跨页设计、2018.10-至今  ◼户外广告设计等。 李雅惠   设 计 师 参 与 事 迹 大学生三下乡 11级财经系书记员 学院学生党支部支部书记 2015 2011 2013 在湖南省湘西自治州保靖县主要负责课题组科研秘书，简单写几句关于此经历的介木芽村小学义 务支教活负责课题组会议安排、财务绍 ，简单写几句简单写几动，被评为优秀支教老师 报销、合同管理等 句关于此经历的介绍 。 邓小平理论研讨会会长 11级党支部书记 11级农林班班长 2012 2011 2013 简单写几句关于此经历的介简单写几句关于此经历的介简单写几句关于此经历的介绍 ，简单写几句简单写几绍 ，简单写几句简单写几绍 ，简单写几句简单写几句关于此经历的介绍 。 句关于此经历的介绍 。 句关于此经历的介绍 。   获 奖 经 历 2011年被评为湖南省“省优秀毕业生”，湘潭大学“校优秀毕业生”   2011年获湘潭大学“优秀共产党员”、湘潭大学“优秀辅导组成员”荣誉称号   2012年获全国数学建模竞赛三等奖，湘潭大学物理竞赛二等奖  2012年获校“优秀社团工作者”荣誉称号  2013年荣获中国科学院“优秀班干部”，“三好学生”荣誉称号  2013年获中国科学院金属研究所“原创科普作品大赛”优秀奖  自 我 评 估  独立负责过大型项目，非常成功的规划了项目 A 工作；  B 项目，从开始到完成，极大地加强了我的逻辑思考能力；  具备艺术家的灵感创作能力，公司公认的首席 PPT 制作人；  非常优秀的用户心理洞察力，配合丰富的创意及文案能力极大地提高了我的执行力。请修改成自己的内容。段前间距设为0.2行。 ",
    "token": {
        "ner": [
            "人物",
            "学校",
            "工作单位"
        ],
        "information": {
            "人物": [
                "性别",
                "出生日期",
                "年龄",
                "职务",
                "电话",
                "邮箱",
                "学历"
            ],
            "学校": [
                "学历",
                "专业",
                "时间",
                "时间段"
            ],
            "工作单位": [
                "职务",
                "时间",
                "时间段"
            ]
        }
    },
    "result": {
        "ner": {
            "人物": [
                "李雅惠"
            ],
            "学校": [
                "湖南大学",
                "湘潭大学",
                "中国科学院"
            ],
            "工作单位": [
                "美铭顾问有限公司",
                "智扬顾问有限公司",
                "铭扬顾问有限公司",
                "中国科学院金属研究所"
            ]
        },
        "information": {
            "李雅惠": {
                "性别": [],
                "出生日期": [],
                "年龄": [
                    "30岁"
                ],
                "职务": [
                    "设计师"
                ],
                "电话": [
                    "13912341210"
                ],
                "邮箱": [
                    "xianqi@taobao.com"
                ],
                "学历": [
                    "本科",
                    "大学"
                ]
            },
            "湖南大学": {
                "学历": [
                    "本科"
                ],
                "专业": [],
                "时间": [],
                "时间段": [
                    "201520112013"
                ]
            },
            "美铭顾问有限公司": {
                "职务": [],
                "时间": [
                    "2011",
                    "2015"
                ],
                "时间段": []
            },
            "湘潭大学": {
                "学历": [],
                "专业": [],
                "时间": [
                    "2011年"
                ],
                "时间段": [
                    "2011年"
                ]
            },
            "智扬顾问有限公司": {
                "职务": [],
                "时间": [
                    "2015.10",
                    "2016.10"
                ],
                "时间段": [
                    "2015.10-2016.10"
                ]
            },
            "铭扬顾问有限公司": {
                "职务": [],
                "时间": [],
                "时间段": []
            },
            "中国科学院": {
                "学历": [],
                "专业": [],
                "时间": [
                    "年"
                ],
                "时间段": [
                    "年"
                ]
            },
            "中国科学院金属研究所": {
                "职务": [],
                "时间": [
                    "年"
                ],
                "时间段": [
                    "年"
                ]
            }
        }
    }
}