{
    "path": "data/dataset_CV/CV/28.docx",
    "text": "陈文婷   简    历    设    计    师      29岁 / 上 海 人 / 汉 族联系方式 教育背景 东华大学 13912341210 xianqi@taobao.com 平面设计 本科 上海浦东新区123路 2012-2016 工 作 经 历 2016.9 – 2018.9 美智顾问有限公司 上海 平面设计师  负责企业画册设计、标志设计、产品包装设计、杂志广告跨页设计、户外广告，◼对公司的网站后台周期性的修改和维护，宣传广告全程负责一直到完成阶段 2018.9至今 素颜堂高新技术有限公司 上海 平面设计师  负责企业画册设计、标志设计、产品包装设计、杂志广告跨页设计、户外广告，◼对公司的网站后台周期性的修改和维护，宣传广告全程负责一直到完成阶段 参 与 事 迹 大学生三下乡 2015年7月  在湖南省湘西自治州保靖县木芽村小学义 务支教活动，被评为优秀支教老师 ◼12级党支部书记 2013年1月  主要负责课题组科研秘书，负责课题组会议安排、财务报销、合同管理等 ◼陈文婷  简    历    设    计    师 2 9 岁 / 上 海 人 / 汉 族  自我总结 个人特长 丰富的社会实践经历 同事公认PPT制作达人   ⚫⚫精益求精的专业态度 会进行基础的网站建设   ⚫⚫爱书法有一定书写能力 修改为突出要点总结   ⚫⚫ 获 奖 经 历  2013年被评为东华大学“校优秀毕业生”  ▪ 2013年获东华大学“优秀共产党员”、 “优秀辅导组成员”荣誉称号  ▪ 2014年获全国数学建模竞赛三等奖，东华大学物理竞赛二等奖 ▪ 2014年获校“优秀社团工作者”荣誉称号 ▪ 2015年荣获中国科学院“优秀班干部”，“三好学生”荣誉称号 ▪ 2015年获中国科学院金属研究所“原创科普作品大赛”优秀奖 ▪技 能 及 其 他 MS Office Adobe中国认证设计师 Photoshop Adobe认证产品专家 Illustrator 平面设计师资格证书 英语 平面设计师资格证书 日语 英语四六级证书 粤语 ",
    "token": {
        "ner": [
            "人物",
            "学校",
            "工作单位"
        ],
        "information": {
            "人物": [
                "性别",
                "出生日期",
                "年龄",
                "职务",
                "电话",
                "邮箱",
                "学历"
            ],
            "学校": [
                "学历",
                "专业",
                "时间",
                "时间段"
            ],
            "工作单位": [
                "职务",
                "时间",
                "时间段"
            ]
        }
    },
    "result": {
        "ner": {
            "人物": [
                "陈文婷"
            ],
            "学校": [
                "东华大学"
            ],
            "工作单位": [
                "素颜堂高新技术有限公司",
                "美智顾问有限公司"
            ]
        },
        "information": {
            "陈文婷": {
                "性别": [],
                "出生日期": [
                    "2016.9",
                    "2015年7月"
                ],
                "年龄": [
                    "29岁",
                    "9岁"
                ],
                "职务": [
                    "设计师",
                    "上海平面设计师"
                ],
                "电话": [
                    "13912341210"
                ],
                "邮箱": [],
                "学历": [
                    "本科"
                ]
            },
            "东华大学": {
                "学历": [
                    "本科"
                ],
                "专业": [
                    "平面设计"
                ],
                "时间": [
                    "2018.9",
                    "2016.9",
                    "2013年"
                ],
                "时间段": [
                    "2016.9–2018.9",
                    "2013年"
                ]
            },
            "素颜堂高新技术有限公司": {
                "职务": [
                    "设计师"
                ],
                "时间": [
                    "2018.9"
                ],
                "时间段": [
                    "2018.9至今"
                ]
            },
            "美智顾问有限公司": {
                "职务": [
                    "设计师"
                ],
                "时间": [
                    "2016.9",
                    "2018.9"
                ],
                "时间段": [
                    "2016.9–2018.9"
                ]
            }
        }
    }
}