{
    "path": "data/dataset_CV/CV/32.docx",
    "text": "   基本资料  姓名：吴美玉 年龄：34岁  籍贯：上海 民族：汉族 吴美玉  学历：本科 专业：设计  简历设计师  教育背景  电子科技大学成都学院 2008-2012 13912341234 电子信息工程 本科 英语四六级证书（均优秀）   全国计算机二级（C语言）  全国计算机三级（网络技术） 123456@163.com  国家业余一级运动员  MS Office   英语  上海，浦东 粤语  某软件  某软件  要点总结 某软件    五年简历设计经验，服务◼工作经历 超过3000客户 宏安外资企业 2020.2至今  在大型广告公司担任过设◼工程部 高级工程师、协调员 计主管，拥有丰富的管理领导20人的技术员+工程师团队   ⚫改进测试硬件及软件以适应不断提高的OEE，yield，经验  ⚫质量目标   数次获得过国内外大小设协调其它团队共同支持新产品投产 ◼ ⚫领导持续改进项目并保障质量管理体系完整性和文档化 计奖项  ⚫管理测试设备和备件  ⚫ 各类平面设计均有涉猎，◼实施软件、固件升级和其它工程变更  ⚫建立和改进测试部门技术员、操作员培训体系 包括广告设计、包装设 ⚫配合客户审计和达成产品认可  ⚫计、宣传页等。 领导团队通过ISO9001内审和外审   ⚫领导团队通过OHSAS18001内审和外审并保证0事故   ⚫  见下页 接上页     工作经历  隆盈数字产品(深圳)有限公司   2017.9-2020.8 IS 技术总监/经理  奈森设计领导10人技术团队   ⚫领导业务支持团队对包括公司各种系统(生产管理，采 ⚫ 购，出货，财务等)系统的日常支持工作。  根据业务需求，调查并导入相关业务支持系统。  填目标职位 ⚫根据用户意见以对业务系统进行改善，并对系统进行二 ⚫次开发。  新的系统的导入和推进，协调开发方和用户之间关系。  ⚫对用户进行业务和系统操作方面的培训。  ⚫13912341234 参与ISO9001内审工作。   ⚫各类应用系统业务流程的整编  ⚫ 使用Six Sigma工具分析和解决问题   ⚫为公司符合美国SOX404法案而从事IS相关规则制定 123456@163.com  ⚫风杭数字产品(深圳)有限公司   2014.9-2017.9 IS 技术总监/经理  领导10人技术团队  ⚫上海，浦东 领导业务支持团队对包括公司各种系统(生产管理，采 ⚫购，出货，财务等)系统的日常支持工作。  根据业务需求，调查并导入相关业务支持系统。  ⚫根据用户意见以对业务系统进行改善，并对系统进行二个人爱好  ⚫ 次开发。 新的系统的导入和推进，协调开发方和用户之间关系。  ⚫ 爬山 ◼对用户进行业务和系统操作方面的培训。  ⚫优宇数字产品(深圳)有限    2012.9-2014.9  跑步 ◼IS 技术总监/经理  读文学作品 领导10人技术团队 ◼ ⚫领导业务支持团队对包括公司各种系统(生产管理，采 ⚫ 音响发烧 ◼购，出货，财务等)系统的日常支持工作。  根据业务需求，调查并导入相关业务支持系统。  ⚫根据用户意见以对业务系统进行改善，并对系统进行二 ⚫次开发。 新的系统的导入和推进，协调开发方和用户之间关系。  ⚫对用户进行业务和系统操作方面的培训。  ⚫参与ISO9001内审工作。   ⚫",
    "token": {
        "ner": [
            "人物",
            "学校",
            "工作单位"
        ],
        "information": {
            "人物": [
                "性别",
                "出生日期",
                "年龄",
                "职务",
                "电话",
                "邮箱",
                "学历"
            ],
            "学校": [
                "学历",
                "专业",
                "时间",
                "时间段"
            ],
            "工作单位": [
                "职务",
                "时间",
                "时间段"
            ]
        }
    },
    "result": {
        "ner": {
            "人物": [
                "吴美玉"
            ],
            "学校": [
                "电子科技大学"
            ],
            "工作单位": [
                "隆盈数字产品(深圳)有限公司",
                "风杭数字产品(深圳)有限公司",
                "优宇数字产品(深圳)有限"
            ]
        },
        "information": {
            "吴美玉": {
                "性别": [],
                "出生日期": [
                    "2017.9"
                ],
                "年龄": [
                    "34岁"
                ],
                "职务": [],
                "电话": [
                    "13912341234"
                ],
                "邮箱": [],
                "学历": [
                    "本科"
                ]
            },
            "电子科技大学": {
                "学历": [
                    "本科"
                ],
                "专业": [
                    "电子信息工程"
                ],
                "时间": [
                    "2008"
                ],
                "时间段": [
                    "2008-2012"
                ]
            },
            "隆盈数字产品(深圳)有限公司": {
                "职务": [
                    "IS技术总监/经理"
                ],
                "时间": [
                    "2017.9",
                    "2020.8",
                    "2020.2"
                ],
                "时间段": [
                    "2017.9-2020.8",
                    "2020.2至今"
                ]
            },
            "风杭数字产品(深圳)有限公司": {
                "职务": [
                    "IS技术总监/经理"
                ],
                "时间": [
                    "2014.9",
                    "2017.9"
                ],
                "时间段": [
                    "2014.9-2017.9"
                ]
            },
            "优宇数字产品(深圳)有限": {
                "职务": [],
                "时间": [
                    "2012.9",
                    "2014.9"
                ],
                "时间段": [
                    "2012.9-2014.9"
                ]
            }
        }
    }
}