{
    "path": "data/dataset_CV/CV/45.docx",
    "text": "    求职简历esume  我，期待一个自我展示的舞台 姓名：胡泰13500135000 电话：service@500d.me 邮箱：  33岁  胡泰13500000000      上海市      Naisen.com       求职方向：设计市场专员 中共党员     工作经历   运营主管                                         策划部实习生  2012.3-2013.7  卓望信息科技有限公司       广州灵心沙文化活动有限公司     2014.8-2016.8     2016.8至今 2013.8-2014.8 华润置地（广州） 迈腾广告有限公司有限公司营销管理部   运营推广主管  市场推广专员      教育背景 2009.09-2013.07               中山大学                       市场营销（本科）  主修课程 ◼基本会计、统计学、市场营销、国际市场营销、市场调查与预测、商业心理学、广告学、公共关系学、货币银行学、经济法、国际贸易、大学英语、经济数学、计算机应用等。  奖项荣耀 ◼2009.10获国家奖学金                         2010.11获“三好学生称号” 2010.12华南大学生创意营销大赛一等奖         2011.4挑战杯创业计划大赛省级铜奖  技能证书 ◼CET-6，优秀的听说写能力；计算机二级，熟悉计算机各项操作；高级营销员，国家职业资格四级   自我评价   本人是市场营销专业毕业生，有丰富的营销知识体系做基础；  对于市场营销方面的前沿和动向有一定的了解，善于分析和吸取经验；  熟悉网络推广，尤其是社会化媒体方面，有独到的见解和经验；  个性开朗，容易相处，团队荣誉感强，熟练各类办公技巧和方法；      尊敬的领导：    您好！   我是中山大学的一名学生，即将面临毕业。四年来，在师友的严格 教益及个人的努力下，我具备了扎实的专业基础知识，系统地掌握了等有关理论;熟悉 涉外工作常用礼仪;具备较好的英语听、说、读、写、译等能力;能熟练操作计算机办公 软件。同时，我利用课余时间广泛地涉猎了大量书籍，不但充实了自己，也培养了自 己多方面的技能。        此外，我还积极地参加各种社会活动，抓住每一个机会，锻炼自己。大学四年，我 深深地感受到，与优秀学生共事，使我在竞争中获益;向实际困难挑战，让我在挫折中 成长。我热爱贵单位所从事的事业，殷切地期望能够在您的领导下，为这一光荣的事业 添砖加瓦;并且在实践中不断学习、进步。随信附上个人求职简历，收笔之际，郑重地提 一个小小的要求：无论您是否选择我，尊敬的领导，希望您能够接受我诚恳的谢意!      此致  敬礼   申请人：胡泰 申请时间： 2013年05月          ",
    "token": {
        "ner": [
            "人物",
            "学校",
            "工作单位"
        ],
        "information": {
            "人物": [
                "性别",
                "出生日期",
                "年龄",
                "职务",
                "电话",
                "邮箱",
                "学历"
            ],
            "学校": [
                "学历",
                "专业",
                "时间",
                "时间段"
            ],
            "工作单位": [
                "职务",
                "时间",
                "时间段"
            ]
        }
    },
    "result": {
        "ner": {
            "人物": [
                "胡泰"
            ],
            "学校": [
                "中山大学"
            ],
            "工作单位": [
                "卓望信息科技有限公司",
                "华润置地（广州）迈腾广告有限公司"
            ]
        },
        "information": {
            "胡泰": {
                "性别": [],
                "出生日期": [
                    "2013年05月"
                ],
                "年龄": [
                    "33岁",
                    "2013年05月"
                ],
                "职务": [
                    "营销管理部运营推广主管市场推广专员"
                ],
                "电话": [
                    "13500135000"
                ],
                "邮箱": [],
                "学历": [
                    "本科"
                ]
            },
            "中山大学": {
                "学历": [
                    "本科"
                ],
                "专业": [
                    "市场营销",
                    "市场营销专业"
                ],
                "时间": [
                    "2009.09",
                    "2013.07",
                    "2016.8",
                    "2014.8",
                    "2010.12",
                    "2010.11",
                    "2013年05月"
                ],
                "时间段": [
                    "2009.09-2013.07",
                    "2016.8至今",
                    "2013.8-2014.8"
                ]
            },
            "卓望信息科技有限公司": {
                "职务": [
                    "运营主管策划部实习生"
                ],
                "时间": [
                    "2012.3",
                    "2013.7"
                ],
                "时间段": [
                    "2012.3-2013.7"
                ]
            },
            "华润置地（广州）迈腾广告有限公司": {
                "职务": [
                    "营销管理部运营推广主管"
                ],
                "时间": [
                    "2016.8",
                    "2013.8",
                    "2016.8",
                    "2014.8"
                ],
                "时间段": [
                    "2013.8-2014.8"
                ]
            }
        }
    }
}