{
    "path": "data/dataset_CV/CV/48.docx",
    "text": " 有两把刷子？ PERSONAL RESUME 姓名：林盈威 电话：18500135000 邮箱：AISEN.COM    林盈威 求职意向：设计市场专业  教育背景  34 2012.9-2015.6              岁南开大学市场营销（硕士）基本会计、统计学、市场营销、国际市场营销、市场调查与预测、商业心理学、广告学、公共关系学、货币银行学、经济法、国际贸易、大学英语、经济数学、计算机应  用等。广东省广州市 2008.9-2012.6                    南开大学市场营销（本科）基本会计、统计学、市场营销、国际市场营销、市场调查与预测、商业心理学、广告135003135000 学、公共关系学、货币银行学、经济法、国际贸易、大学英语、经济数学、计算机应 用等。service@500d.me  工作经验  2009.32012.6       一南开大学职业发展社社长 负责社团组织建设，社团机构的管理，协调各部门工作; ⚫Photoshop  组织策划社团的成立大会、竞选会、团队培训、招新等运维活动; ⚫ 2016.32022.10        AI 一伟天科技集团市场部主管 协助筹备“不可思议”大型市场推广广州站系列活动； ⚫ 作为品牌大使向观众、来宾和媒体推广伟天旗下的品牌； Word ⚫ 联络各家媒体如南方都市晚报、广州日报，G4频道对本次活动进行报道； ⚫Excel  奖项荣誉  2009.10 获国家奖学金2010.11“” 获三好学生称号兴趣爱2010.12 大学生创意营销大赛一等奖 好2011.4 挑战杯创业计划大赛省级铜奖CET-6 ，优秀的听说写能力 计算机二级，熟悉计算机各项操作   篮球高级营销员，国家资格证四级影音 自我评价   电子互联网 本人是市场营销专业毕业生，有丰富的营销知识体系做基础；对于市场营销方面的前沿和动向有一定的了解，善于分析和吸取经验熟悉网络推广，尤其是社会化媒体方面， 有独到的见解和经验，个性开朗，容易相处，团队荣誉感强。  户外阅读   尊敬的领导：    您好！   我是南开大学的一名学生，即将面临毕业。四年来，在师友的严格 教益及个人的努力下，我具备了扎实的专业基础知识，系统地掌握了等有关理论;熟悉 涉外工作常用礼仪;具备较好的英语听、说、读、写、译等能力;能熟练操作计算机办公 软件。同时，我利用课余时间广泛地涉猎了大量书籍，不但充实了自己，也培养了自 己多方面的技能。        此外，我还积极地参加各种社会活动，抓住每一个机会，锻炼自己。大学四年，我 深深地感受到，与优秀学生共事，使我在竞争中获益;向实际困难挑战，让我在挫折中 成长。我热爱贵单位所从事的事业，殷切地期望能够在您的领导下，为这一光荣的事业 添砖加瓦;并且在实践中不断学习、进步。随信附上个人求职简历，收笔之际，郑重地提 一个小小的要求：无论您是否选择我，尊敬的领导，希望您能够接受我诚恳的谢意!      此致  敬礼   申请人：林盈威 申请时间： 2015年05月        ",
    "token": {
        "ner": [
            "人物",
            "学校",
            "工作单位"
        ],
        "information": {
            "人物": [
                "性别",
                "出生日期",
                "年龄",
                "职务",
                "电话",
                "邮箱",
                "学历"
            ],
            "学校": [
                "学历",
                "专业",
                "时间",
                "时间段"
            ],
            "工作单位": [
                "职务",
                "时间",
                "时间段"
            ]
        }
    },
    "result": {
        "ner": {
            "人物": [
                "林盈威"
            ],
            "学校": [
                "南开大学"
            ],
            "工作单位": [
                "AI一伟天科技集团"
            ]
        },
        "information": {
            "林盈威": {
                "性别": [],
                "出生日期": [
                    "2008.9",
                    "2012.6",
                    "2012.9",
                    "2015年05月"
                ],
                "年龄": [
                    "2015.6",
                    "2012.9",
                    "2015年05月"
                ],
                "职务": [],
                "电话": [
                    "18500135000"
                ],
                "邮箱": [
                    "AISEN.COM"
                ],
                "学历": [
                    "硕士"
                ]
            },
            "南开大学": {
                "学历": [
                    "硕士",
                    "本科"
                ],
                "专业": [
                    "市场营销"
                ],
                "时间": [
                    "2012.9",
                    "2008.9",
                    "2012.6",
                    "2009.32012.6",
                    "2015年05月"
                ],
                "时间段": [
                    "2012.9-2015.6岁",
                    "2008.9-2012.6"
                ]
            },
            "AI一伟天科技集团": {
                "职务": [
                    "市场部主管"
                ],
                "时间": [
                    "2016.32022.10"
                ],
                "时间段": []
            }
        }
    }
}