{
    "path": "data/dataset_CV/CV/55.docx",
    "text": "   R 求职简历 esume 我，期待一个自我展示的舞台 姓名：姚扬云 电话：188 0000 0000 邮箱：yaoyangyun@qq.com    1989/08/12         naisen.com                                   naisen.com              中国.上海          姚扬云  求职意向：市场专员      个人介绍 PERSONAL INTRODUCTION  本人是市场营销专业毕业生，有丰富的营销知识体系做基础；对于市场营销方面的前沿和动向有一定的了解，善于分析和吸取经验熟悉网络推广，尤其是社会化媒体方面，有独到的见解和经验个性开朗，容易相处。    教育背景 EDUCATION BACKGROUND 工作经历 WORK EXPERIENCE  2014.9-2017.7   中国传媒大学    艺术设计（博士） 2021.7-2022.8     深圳华龙科技      市场经理        熟练操作photoshop、Illustrator、CelDRAW等图形，负责社团组织建设，社团机构的管理，协调各部门工作;图像设计软件.并能独力设计,制作各种广告,设计宣传. 组织策划社团的成立大会、竞选会、招新等运维活动;   2011.9-2014.7     中山大学    三维动画设计（硕2020.7-2021.7    中国顺华科技  产品策划        士） 协助筹备“不可思议”大型市场推广广州站系列活动；作熟练操作photoshop、Illustrator、Dreamweaver、为品牌大使向观众、来宾和媒体推广集团旗下的品牌； CelDRAW等图形，图像设计软件.并能独力设计,制作各 2017.7-2020.7    广州旭景信息科技  UI设计种广告,设 计宣传.  协助筹备“不可思议”大型市场推广广州站系列活动；作 2007.9-2011.7     中山大学    三维动画设计（本为品牌大使向观众、来宾和媒体推广集团旗下的品牌； 科）                熟练操作photoshop、Illustrator、Dreamweaver、获得荣誉 GET THE HONOR CelDRAW等图形，图像设计软件.并能独力设计,制作各种广告,设计宣传.  大学一直担任班长，荣获“优秀班干”     ⚫  在校园创业者协会担任“宣传部长”  ⚫ 主修课程 MAJOR IN COURSE  2011年荣获第四届全国大学生广告艺术设计大赛平面⚫ 作品类三等奖。 广告摄影、三维动画基础、CI设计与制作、多媒体影视 校园文化节“微观江大，聚焦精彩”微博评选大赛中获 ⚫制作、中外美术史、艺术概论、平面广告设计、广告策“十大美友”奖 划、计算机文化基础、广告传播学；广告摄影、三维动画基础、艺术概论、平面广告设计、广告策划、计算机文化基础、广告传播学    软件技能 SOFTWARE SKILLS Photoshop                      word                            Illustrator Photoshop                      word                            Illustrator    自荐书 尊敬的领导：    您好！   我是中国传媒大学艺术系的一名学生，即将面临毕业。四年来，在师友的严格 教益及个人的努力下，我具备了扎实的专业基础知识，系统地掌握了等有关理论;熟悉 涉外工作常用礼仪;具备较好的英语听、说、读、写、译等能力;能熟练操作计算机办公 软件。同时，我利用课余时间广泛地涉猎了大量书籍，不但充实了自己，也培养了自 己多方面的技能。        此外，我还积极地参加各种社会活动，抓住每一个机会，锻炼自己。大学四年，我 深深地感受到，与优秀学生共事，使我在竞争中获益;向实际困难挑战，让我在挫折中 成长。我热爱贵单位所从事的事业，殷切地期望能够在您的领导下，为这一光荣的事业 添砖加瓦;并且在实践中不断学习、进步。随信附上个人求职简历，收笔之际，郑重地提 一个小小的要求：无论您是否选择我，尊敬的领导，希望您能够接受我诚恳的谢意!      此致  敬礼   申请人：姚扬云 申请时间： 2017年04月          ",
    "token": {
        "ner": [
            "人物",
            "学校",
            "工作单位"
        ],
        "information": {
            "人物": [
                "性别",
                "出生日期",
                "年龄",
                "职务",
                "电话",
                "邮箱",
                "学历"
            ],
            "学校": [
                "学历",
                "专业",
                "时间",
                "时间段"
            ],
            "工作单位": [
                "职务",
                "时间",
                "时间段"
            ]
        }
    },
    "result": {
        "ner": {
            "人物": [
                "姚扬云"
            ],
            "学校": [
                "中国传媒大学",
                "中山大学"
            ],
            "工作单位": [
                "广州旭景信息科技",
                "校园创业者协会"
            ]
        },
        "information": {
            "姚扬云": {
                "性别": [],
                "出生日期": [
                    "1989/08/12",
                    "2017年04月"
                ],
                "年龄": [
                    "2017年04月"
                ],
                "职务": [
                    "市场专员"
                ],
                "电话": [
                    "18800000000"
                ],
                "邮箱": [
                    "yaoyangyun@qq.com"
                ],
                "学历": [
                    "博士"
                ]
            },
            "中国传媒大学": {
                "学历": [
                    "博士"
                ],
                "专业": [
                    "艺术设计",
                    "艺术系"
                ],
                "时间": [
                    "2017.7",
                    "2014.9",
                    "2011年",
                    "2017年04月"
                ],
                "时间段": [
                    "2014.9-2017.7",
                    "2021.7-2022.8"
                ]
            },
            "中山大学": {
                "学历": [
                    "硕"
                ],
                "专业": [
                    "三维动画设计"
                ],
                "时间": [
                    "2011.9",
                    "2014.7",
                    "2007.9",
                    "2011.7"
                ],
                "时间段": [
                    "2020.7-2021.7",
                    "2007.9-2011.7",
                    "2011.9-2014.7"
                ]
            },
            "广州旭景信息科技": {
                "职务": [],
                "时间": [
                    "20.7",
                    "2007.9",
                    "2011.7"
                ],
                "时间段": [
                    "2007.9-2011.7",
                    "20.7"
                ]
            },
            "校园创业者协会": {
                "职务": [
                    "宣传部长"
                ],
                "时间": [
                    "2011年"
                ],
                "时间段": [
                    "2011年"
                ]
            }
        }
    }
}