{
    "path": "data/dataset_CV/CV/57.docx",
    "text": "R    求职简历esume 我，期待一个合适的位置                 王雅顺1888888000             Naisen.com                    市场专员 RERSONAL RESUME  求职意向/行政专员         王雅顺 个人资料  WU BAI DING    出生年月：1996/09/09  毕业院校：常州信息职业技术学院  专    业：艺术设计 主修课程 政治面貌：中共党员  健康状况：良好 广告摄影、三维动画基础、CI设计与制作、多媒体影视制作、中外美术史、艺术概论、 平面广告设计、广告策划、计算机文化基础、广告传播学；广告摄影、三维动画基础、CI手     机：138 0000 8888 设计与制作、多媒体影视制作、中外美术史、艺术概论、平面广告设计、广告策划、计算邮     箱：service@500d,me 机文化基础、广告传播学 地     址：广东广州    获得荣誉 工作经历  2021.7-2023.3           深圳华为科技           市场经理助理          大学一直担任班长，荣获“优秀班干”     ⚫负责社团组织建设，社团机构的管理，协调各部门工作;组织策划社团的成立大会、 在校园创业者协会担任“宣传部长”  ⚫竞选会、团队培训、招新等运维活动;  2016年荣获第四届全国大学生广 ⚫   艺术设计大赛平面作品类三等奖。 ⚫2018.7-2021.7           中国移动南方基地       和彩云产品策划         校园文化节“微观江大，聚焦精彩”微博评⚫协助筹备“不可思议”大型市场推广广州站系列活动；作为品牌大使向观众、来宾选大赛中获 “十大美友”奖 和媒体推广一百丁集团旗下的品牌；  软件技能  2017.7-2018.7           广州奈森信息科技     UI设计 协助筹备“不可思议”大型市场推广广州站系列活动；作为品牌大使向观众、来宾和Photoshop 媒体推广一百丁集团旗下的品牌； Illustrator   Axure RP 教育背景 Word   英语  普通话 自我评价 2014.9-2017.7           江苏建筑职业技术学院      艺术设计                     熟练操作photoshop、Illustrator、CelDRAW等图形，图像设计软件.并能独力设本人是市场营销专业毕业生，有丰富的营销计,制作各种广告,设计宣传.  知识体系做基础；对于市场营销方面的前沿  和动向有一定的了解，善于分析和吸取经验熟悉网络推广，尤其是社会化媒体方面，有独到的见解和经验个性开朗，容易相处。  尊敬的领导：    您好！   我是常州信息职业技术学院的一名学生，即将面临毕业。四年来，在师友的严格 教益及个人的努力下，我具备了扎实的专业基础知识，系统地掌握了等有关理论;熟悉 涉外工作常用礼仪;具备较好的英语听、说、读、写、译等能力;能熟练操作计算机办公 软件。同时，我利用课余时间广泛地涉猎了大量书籍，不但充实了自己，也培养了自 己多方面的技能。        此外，我还积极地参加各种社会活动，抓住每一个机会，锻炼自己。大学四年，我 深深地感受到，与优秀学生共事，使我在竞争中获益;向实际困难挑战，让我在挫折中 成长。我热爱贵单位所从事的事业，殷切地期望能够在您的领导下，为这一光荣的事业 添砖加瓦;并且在实践中不断学习、进步。随信附上个人求职简历，收笔之际，郑重地提 一个小小的要求：无论您是否选择我，尊敬的领导，希望您能够接受我诚恳的谢意!      此致  敬礼   申请人：王雅顺 申请时间： 2017年05月          ",
    "token": {
        "ner": [
            "人物",
            "学校",
            "工作单位"
        ],
        "information": {
            "人物": [
                "性别",
                "出生日期",
                "年龄",
                "职务",
                "电话",
                "邮箱",
                "学历"
            ],
            "学校": [
                "学历",
                "专业",
                "时间",
                "时间段"
            ],
            "工作单位": [
                "职务",
                "时间",
                "时间段"
            ]
        }
    },
    "result": {
        "ner": {
            "人物": [
                "王雅顺"
            ],
            "学校": [
                "常州信息职业技术学院",
                "江苏建筑职业技术学院"
            ],
            "工作单位": []
        },
        "information": {
            "王雅顺": {
                "性别": [],
                "出生日期": [
                    "1996/09/09",
                    "2017年05月"
                ],
                "年龄": [
                    "1996/09/09",
                    "2017年05月"
                ],
                "职务": [
                    "市场专员"
                ],
                "电话": [
                    "1888888000"
                ],
                "邮箱": [
                    "service@500d,me"
                ],
                "学历": []
            },
            "常州信息职业技术学院": {
                "学历": [],
                "专业": [
                    "艺术设计",
                    "市场营销专业"
                ],
                "时间": [
                    "1996/09/09",
                    "2021.7"
                ],
                "时间段": []
            },
            "江苏建筑职业技术学院": {
                "学历": [],
                "专业": [
                    "市场营销专业"
                ],
                "时间": [
                    "2017.7",
                    "2014.9",
                    "2018.7"
                ],
                "时间段": [
                    "2014.9-2017.7",
                    "2017.7-2018.7"
                ]
            }
        }
    }
}