{
    "path": "data/dataset_CV/CV/59.docx",
    "text": "   个人简历PERSONAL RESUME 陈政圣 180 0000 8888 naisen.com 教育背景                                EDUCATION   2010-2013        北京医学高等专科学校                  临床医学  系统解剖，局部解剖，组织胚胎，生理，生化，病理学，病理生理学，药理学，诊 断学，内科，外科，妇产科学，儿科学（小儿内科学 小儿外科学 小儿传染病 儿童 保健学 ），卫生学，马克思主义哲学原理，马克思主义政治经济学，毛概，医学影像学，病原微生物学，神经病学，精神病学，细胞生物学，医学伦理学，分子生物 学，流行病学，医学统计学，循征医学等。    工作经验                                EXPERIENCE 陈政圣   2019.1至今        江西省人民医院（三级甲等医院）     修心脑血科医生 WU BAI DING 1、从事中西医结合治疗内儿科及妇科。采用中医调整阴阳失调，培补肺脾肾方法 求职意向：医护 及西医对症处理治疗儿科难症取得理想效果，得到家长的一致好评。    2、妇科用中药调理气血，疏肝理气内服配与中药外洗、外敷、灌肠综合治疗积累丰富经验达到明显效果。 基本信息  2015.1-2019.1      南京大学附属第三医院                   门诊急诊科 1、从事中西医结合治疗内儿科及妇科。采用中医调整阴阳失调，培补肺脾肾方法生日：1992.04.06 及西医对症处理治疗儿科难症取得理想效果，得到家长的一致好评。  住址：上海市 2、妇科用中药调理气血，疏肝理气内服配与中药外洗、外敷、灌肠综合治疗积累丰富经验达到明显效果。 电话：1888008000  2014.1-2015.1       中山大学附属第三医院                   门诊急诊科 邮箱：service@500d.me 1、从事中西医结合治疗内儿科及妇科。采用中医调整阴阳失调，培补肺脾肾方法及西医对症处理治疗儿科难症取得理想效果，得到家长的一致好评。  2、妇科用中药调理气血，疏肝理气内服配与中药外洗、外敷、灌肠综合治疗积累丰富经验达到明显效果。 社会实践                           SOCIAL PRACTICE 1、2010-2011年在南华大学医学院“爱心支教社”组织下参与为期半年呆鹰岭小学爱心支教工作，后半期参与社团部硬件维护工作。 2、2011.02-2011.11在湘潭市中心医院完成临床（儿科、骨科、神经内科、皮肤科、等）见习。  3、2012.02- 2012.07在湘潭市中心医院完成临床（肾病风湿免疫科，骨科，普外二科、呼吸内科、内分泌科、心内科、烧伤科、传染内科、心胸外科）实习。  3、2013.02- 2013.06在湖南省儿童医院完成小儿内科、小儿外科、小儿传染病学、儿科保健学、急诊病学等相关医学理论学习，并在医院相关科室完成临床见习。  奖项荣誉                        THE AWARDS HONR 2012年度第十七期入党积极分子培训合格，被评为“入党积极分子。  2012年度一次性通过全国计算机二级考试。  2011年度被南华医学院分团委健康365服务队评为“优秀队员”。  2010.09-2012.09年度担任过三期副班长。 阅读 音乐 个人技能                           PERSONAL SKILLS ★ 学过计算机应用基础、数据库原理、计算机网络与应用、VB软件工程  运动 ★ 可以熟练运用Word、Excel、PowerPoint等数据库软件和和办公软件    尊敬的领导：   您好！本人欲申请贵公司在报纸上刊登征求医药代表的职位。我 自信符合贵公司的要求。首先向你致意诚恳的谢意，感谢您百之中抽 出时间来查阅我的求职信！     2013年7月，我从北京医学高等专科学校毕业。所学专业为临床医 学。通过3年的在校学习，掌握了基本的医学知识，并多次参加学校 组织的各种实习活动。     在大学期间，我还积极地参加各种社会活动，抓住每一个机会，锻 炼自己。大学四年，我深深地感受到，与优秀学生共事，使我在竞争 中获益；向实际困难挑战，让我在挫折中成长。祖辈们教我勤奋、尽 责、善良、正直；中国人民大学培养了我实事求是、开拓进取的作风。  我热爱贵单位所从事的事业，殷切地期望能够在您的领导下，为这一 光荣的事业添砖加瓦；并且在实践中不断学习、进步。   如今的医疗行业正在蓬勃发展，我愿加入其中，为中国医疗事业 和贵公司的发展做出自己的贡献。     收笔之际，郑重地提一个小小的要求： 无论您是否选择我，尊敬的 领导，希望您能够接受我诚恳的谢意！     祝愿贵公司事业蒸蒸日上！    此致 敬礼!  申请人：   陈政圣 申请时间：2013年07月    ",
    "token": {
        "ner": [
            "人物",
            "学校",
            "工作单位"
        ],
        "information": {
            "人物": [
                "性别",
                "出生日期",
                "年龄",
                "职务",
                "电话",
                "邮箱",
                "学历"
            ],
            "学校": [
                "学历",
                "专业",
                "时间",
                "时间段"
            ],
            "工作单位": [
                "职务",
                "时间",
                "时间段"
            ]
        }
    },
    "result": {
        "ner": {
            "人物": [
                "陈政圣"
            ],
            "学校": [
                "北京医学高等专科学校",
                "南京大学",
                "中山大学",
                "中国人民大学"
            ],
            "工作单位": [
                "江西省人民医院"
            ]
        },
        "information": {
            "陈政圣": {
                "性别": [],
                "出生日期": [
                    "1992.04.06",
                    "2019.1",
                    "2013年07月"
                ],
                "年龄": [
                    "2019.1",
                    "2013年07月"
                ],
                "职务": [
                    "医药代表"
                ],
                "电话": [
                    "18000008888",
                    "1888008000"
                ],
                "邮箱": [
                    "service@500d.me"
                ],
                "学历": []
            },
            "北京医学高等专科学校": {
                "学历": [],
                "专业": [
                    "临床医学"
                ],
                "时间": [
                    "2010",
                    "2013",
                    "2013年7月"
                ],
                "时间段": [
                    "2010-2013",
                    "2013年7月"
                ]
            },
            "江西省人民医院": {
                "职务": [],
                "时间": [
                    "2019.1"
                ],
                "时间段": [
                    "2019.1至今"
                ]
            },
            "南京大学": {
                "学历": [],
                "专业": [
                    "妇科"
                ],
                "时间": [
                    "2019.1",
                    "2015.1"
                ],
                "时间段": [
                    "2015.1-2019.1"
                ]
            },
            "中山大学": {
                "学历": [],
                "专业": [],
                "时间": [
                    "2014.1",
                    "2015.1"
                ],
                "时间段": [
                    "2014.1-2015.1"
                ]
            },
            "中国人民大学": {
                "学历": [],
                "专业": [],
                "时间": [
                    "2013年07月"
                ],
                "时间段": []
            }
        }
    }
}