{
    "path": "data/dataset_CV/CV/62.docx",
    "text": " NESSON林雅慧 市场拓展/策划     技能水平 关于我   ADOBE PHOTOSHOP 本人24岁，工作5年，有丰富的营销知识体 系做基础；对于市场营销方面的前沿和动向有MICROSOFT WORD 一定的了解，善于分析和吸取经验；熟悉网络 推广，尤其是社会化媒体方面，有独到的见解MICROSOFT POWERPOINT 和经验；个性开朗，容易相处，团队荣誉感强。   本人是市场营销专业毕业生，有丰富的营销知兴趣爱好 识体系做基础；   教育背景 篮球 / 登山 / 手工 / 电影 / 音乐   2015.9-2018.7      广州市轻工职业学校       市场营销（中专） 优势特长 基本会计、统计学、市场营销、国际市场营销、市场调查与预测、商业心理学。    奖项  2017.10获国家奖学金   2017.11获“三好学生称号” 写作     策划      摄影  2016.12创意营销大赛一等奖   2016.4挑战杯创业计划大赛铜奖  工作经验 联系我   2021年10月-2023年3月   龙友设计科技有限公司  运营推广  负责社会化媒体营销团队的搭建工作，制定相关运营策略和指标，带领团队实施工作地点：广东省广州市 计划； 网站常态运营活动规划和推进执行； 相关数据报告和统计，为公司决策 层提决策依据； 电话号码：13500135000    2019年10月-2021年10月   锋林设计科技有限公司  运营推广 邮箱地址：Service@500d.me 负责社会化媒体营销团队的搭建工作，制定相关运营策略和指标，带领团队实施计划； 网站常态运营活动规划和推进执行； 相关数据报告和统计，为公司决策层提决策依据   2018年10月-2019年10月   鸿力设计科技有限公司  运营推广 负责社会化媒体营销团队的搭建工作，制定相关运营策略和指标，带领团队实施计划；网站常态运营活动规划和推进执行； 相关数据报告和统计，为公司决策层提决策依 ",
    "token": {
        "ner": [
            "人物",
            "学校",
            "工作单位"
        ],
        "information": {
            "人物": [
                "性别",
                "出生日期",
                "年龄",
                "职务",
                "电话",
                "邮箱",
                "学历"
            ],
            "学校": [
                "学历",
                "专业",
                "时间",
                "时间段"
            ],
            "工作单位": [
                "职务",
                "时间",
                "时间段"
            ]
        }
    },
    "result": {
        "ner": {
            "人物": [
                "林雅慧"
            ],
            "学校": [
                "广州市轻工职业学校"
            ],
            "工作单位": [
                "龙友设计科技有限公司",
                "锋林设计科技有限公司"
            ]
        },
        "information": {
            "林雅慧": {
                "性别": [],
                "出生日期": [
                    "2015.9"
                ],
                "年龄": [
                    "24岁"
                ],
                "职务": [
                    "市场拓展/策划"
                ],
                "电话": [
                    "13500135000"
                ],
                "邮箱": [
                    "Service@500d.me"
                ],
                "学历": [
                    "中专"
                ]
            },
            "广州市轻工职业学校": {
                "学历": [
                    "中专"
                ],
                "专业": [
                    "市场营销专业",
                    "市场营销"
                ],
                "时间": [
                    "2018.7",
                    "2015.9"
                ],
                "时间段": [
                    "2015.9-2018.7"
                ]
            },
            "龙友设计科技有限公司": {
                "职务": [
                    "运营推广"
                ],
                "时间": [
                    "2023年3月",
                    "2021年10月",
                    "2015.9",
                    "2018.7"
                ],
                "时间段": [
                    "2021年10月-2023年3月"
                ]
            },
            "锋林设计科技有限公司": {
                "职务": [],
                "时间": [
                    "2021年10月",
                    "2019年10月"
                ],
                "时间段": [
                    "2019年10月-2021年10月"
                ]
            }
        }
    }
}