{
    "path": "data/dataset_CV/CV/63.docx",
    "text": "  陈育福-个人简历 Name 联系方式 Profile  手 机  (+86) 138-0011-1000 应聘:电子商务运营专员  邮 箱  office@microsoft.com • 具备电子商务运营实习经历  微 信  123456• 具备网络推广及沟通协调丰富经验  Experience 杭州法哲贸易有限公司        杭州，中国     07.2021 至今 运营  协助运营总监管理1家天猫店、2家淘宝C店日常运营工作 • 负责店铺基础管理、活动策划、渠道分销、资源拓展等工作的沟通协调 • 负责每周六团队例会会议纪要，针对客服每周问题进行归纳总结 • 成功将店铺DRS从低于行业水平提高到高出行业水平20% • 协助会员经营高级经理发展店铺会员，以淘宝后院为平台成功举行了多次活动，并对•会员QQ群日常的维护  负责申报聚划算、淘宝清仓、u站等活动 •北京恩鼎贸易有限公司             北京，中国        07.201907.2021 日月光华版编辑  论坛版主，坚持定期发布基于网络的文档、规章 • 将4版从日人均流量提升至1000+，成为最有影响力的版面 • 网站内容方面与sohu合作，并定期与同内容网站进行交流，资源共享，提升人气 •  先后选拔几十名人才，按其特长分配工作并协调他们合作 •樱学社（社团）09.2015 北京，中国                     06.2019 部长   樱学社是校明星社团，拥有约500名会员（校内规模最大） • 负责定期组织“初级日语教学”、“日本影视交流”及日语角活动 • 负责组织两次“学园祭”活动，以及大型晚会“中日文化交流节闭幕式 • 组织协调能力获得社团同侪及会员认同，连任两届社团组织部长 •中国移动充值话费返还活动（实习）07.2018 北京，中国     兼职  一个月内，每日中午坚持在本校和其他3所高校发放传单，风雨无阻 • 用扫楼、摆摊等方式做宣传，克服保安、管理员及楼长干扰，扫过4所高校30余幢•宿舍楼，在校内高客流地段摆摊10余次，一共获得105名顾客  三次获得中移动校园地推团队“月度推广明星”荣誉• Education 北京市对外贸易学校 2016.09-2019.06    上海-中国 Skill ●  ●  ●  ●  ●网络营销    有实践经验   生日：2001年10月19日 沟通交流    熟练掌握    ●  ●  ●  ●  ●专业： 市场营销 语言表达                 ●  ●  ●  ●  ● 辅修： 电子商务 文笔写作  每天坚持写微博   ●  ●  ●  ●  ●学历： 中专 自学能力 ●  ●  ●  ●  ●  Personality 微博   拥有粉丝过千的微博账号：OfficePlus微软在线 爱生活，爱运动，爱熬夜 Hobby 羽毛球  学院羽毛球比赛双打第三名 不爱放弃，不爱妥协 网购达人  淘宝罕见四钻买家 勇往直前的电商小强一枚   ",
    "token": {
        "ner": [
            "人物",
            "学校",
            "工作单位"
        ],
        "information": {
            "人物": [
                "性别",
                "出生日期",
                "年龄",
                "职务",
                "电话",
                "邮箱",
                "学历"
            ],
            "学校": [
                "学历",
                "专业",
                "时间",
                "时间段"
            ],
            "工作单位": [
                "职务",
                "时间",
                "时间段"
            ]
        }
    },
    "result": {
        "ner": {
            "人物": [
                "陈育福"
            ],
            "学校": [
                "北京市对外贸易学校"
            ],
            "工作单位": [
                "杭州法哲贸易有限公司",
                "北京恩鼎贸易有限公司",
                "樱学社"
            ]
        },
        "information": {
            "陈育福": {
                "性别": [],
                "出生日期": [
                    "07.2021"
                ],
                "年龄": [
                    "07.2021"
                ],
                "职务": [
                    "电子商务运营专员",
                    "运营协助运营总监"
                ],
                "电话": [
                    "138-0011-1000"
                ],
                "邮箱": [
                    "office@microsoft.com"
                ],
                "学历": []
            },
            "杭州法哲贸易有限公司": {
                "职务": [
                    "协助运营总监"
                ],
                "时间": [
                    "07.2021"
                ],
                "时间段": []
            },
            "北京恩鼎贸易有限公司": {
                "职务": [],
                "时间": [
                    "07.2019"
                ],
                "时间段": []
            },
            "北京市对外贸易学校": {
                "学历": [
                    "中专"
                ],
                "专业": [
                    "网络营销"
                ],
                "时间": [
                    "2016.09",
                    "2019.06"
                ],
                "时间段": [
                    "2016.09-2019.06"
                ]
            },
            "樱学社": {
                "职务": [
                    "部长"
                ],
                "时间": [
                    "09.2015"
                ],
                "时间段": []
            }
        }
    }
}