{
    "path": "data/dataset_CV/CV/67.docx",
    "text": "李凯婷-个人简历 教 育 背 景  北京某大设计学院 2012 - 2015 设计专业 中专 2012年9月获得Adobe中国认证设计师  ◼2013年1月获得Adobe认证产品专家  ◼基本信息 2013年8月获得平面设计师资格证书  ◼2014年9月获得平面设计师资格证书  ◼姓名：李凯婷 2014年5月获得英语四六级证书  ◼年龄：27岁 籍贯：上海 MS Office 民族：汉族 Photoshop Illustrator 学历：中专 英语 专业：设计 日语 粤语 联系方式 工 作 经 历 2021.10至今 朗赛室内设计有限公司 上海 平面设计师 13912345678 写一段介绍工作内容的说明，关于工作职责，获得的业绩情况 ◼写一段介绍工作内容的说明，关于工作职责，获得的业绩情况 ◼写一段介绍工作内容的说明，关于工作职责，获得的业绩情况 ◼13912@163.com 2019.10 – 2021.10 宏森室内设计有限公司 上海 平面设计师 写一段介绍工作内容的说明，关于工作职责，获得的业绩情况 ◼上海，浦东 写一段介绍工作内容的说明，关于工作职责，获得的业绩情况 ◼写一段介绍工作内容的说明，关于工作职责，获得的业绩情况 ◼2017.10 – 2019.10 西伦全屋定制有限公司 上海 平面设计师 自我总结 写一段介绍工作内容的说明，关于工作职责，获得的业绩情况 ◼写一段介绍工作内容的说明，关于工作职责，获得的业绩情况 ◼丰富的社会实践经历  ⚫写一段介绍工作内容的说明，关于工作职责，获得的业绩情况 ◼精益求精的专业态度  ⚫2016.10 – 2017.10 建龙全屋定制有限公司 修改为突出要点总结  ⚫上海 平面设计师 必须要简单直接明了  写一段介绍工作内容的说明，关于工作职责，获得的业绩情况 ⚫◼写一段介绍工作内容的说明，关于工作职责，获得的业绩情况 ◼写一段介绍工作内容的说明，关于工作职责，获得的业绩情况 ◼",
    "token": {
        "ner": [
            "人物",
            "学校",
            "工作单位"
        ],
        "information": {
            "人物": [
                "性别",
                "出生日期",
                "年龄",
                "职务",
                "电话",
                "邮箱",
                "学历"
            ],
            "学校": [
                "学历",
                "专业",
                "时间",
                "时间段"
            ],
            "工作单位": [
                "职务",
                "时间",
                "时间段"
            ]
        }
    },
    "result": {
        "ner": {
            "人物": [
                "李凯婷"
            ],
            "学校": [
                "北京某大设计学院"
            ],
            "工作单位": [
                "朗赛室内设计有限公司",
                "西伦全屋定制有限公司"
            ]
        },
        "information": {
            "李凯婷": {
                "性别": [],
                "出生日期": [
                    "2014年5月"
                ],
                "年龄": [
                    "27岁"
                ],
                "职务": [],
                "电话": [
                    "13912345678"
                ],
                "邮箱": [],
                "学历": [
                    "中专",
                    "中专"
                ]
            },
            "北京某大设计学院": {
                "学历": [
                    "中专"
                ],
                "专业": [
                    "设计专业"
                ],
                "时间": [],
                "时间段": [
                    "2012-2015"
                ]
            },
            "朗赛室内设计有限公司": {
                "职务": [
                    "上海平面设计师"
                ],
                "时间": [
                    "2021.10"
                ],
                "时间段": [
                    "2021.10至今"
                ]
            },
            "西伦全屋定制有限公司": {
                "职务": [
                    "上海平面设计师"
                ],
                "时间": [
                    "2017.10",
                    "2019.10"
                ],
                "时间段": [
                    "2017.10–2019.10"
                ]
            }
        }
    }
}