{
    "path": "data/dataset_CV/CV/70.docx",
    "text": " :工作经历      易烽设计服务有限公司 平面设计师   2021.7 –至今   写几句简单的介绍，关于工作内容，锻炼了哪些能力  ⚫  写几句简单的介绍，关于工作内容，获得哪些业绩  ⚫ 宋慧元 写几句简单的介绍，关于工作内容，获得哪些业绩   ⚫ 写几句简单的介绍，关于工作内容，获得哪些业绩  ⚫  西光设计服务有限公司 平面设计师 求职意向：简历设计师  2019.7 –2021.7  基 本 资 料 写几句简单的介绍，关于工作内容，锻炼了哪些能力  ⚫写几句简单的介绍，关于工作内容，获得哪些业绩  ⚫ 写几句简单的介绍，关于工作内容，获得哪些业绩  ⚫姓名：宋慧元  写几句简单的介绍，关于工作内容，获得哪些业绩  ⚫年龄：29岁 平面设计师 圣荣设计服务有限公司 民族：汉族 2014.7 –2019.7 籍贯：山东 写几句简单的介绍，关于工作内容，锻炼了哪些能力  ⚫学历：中专 写几句简单的介绍，关于工作内容，获得哪些业绩  ⚫专业：设计 写几句简单的介绍，关于工作内容，获得哪些业绩  ⚫写几句简单的介绍，关于工作内容，获得哪些业绩  ⚫13912345678 恩鼎设计服务有限公司 平面设计师 2013.7 –2014.7 Yourname@163.com 写几句简单的介绍，关于工作内容，锻炼了哪些能力  ⚫写几句简单的介绍，关于工作内容，获得哪些业绩  ⚫写几句简单的介绍，关于工作内容，获得哪些业绩  ⚫自我评估 写几句简单的介绍，关于工作内容，获得哪些业绩  ⚫ 思维灵活，大方稳重，责任心◼教育背景 强，具有较强的团队精神  请修改为自己的个人评价、自我◼总结性的信息 中专 章丘中等职业学校  思维灵活，大方稳重，责任心◼设计专业 2010.9 –2013.6 强，具有较强的团队精神  请修改为自己的个人评价、自我◼总结性的信息 掌握技能 获得证书 Ms Office办公软件 Adobe中国认证设计师  Photoshop软件 Adobe认证产品专家  平面设计师资格证书 某某专业软件  英语四六级证书  某某专业软件 ",
    "token": {
        "ner": [
            "人物",
            "学校",
            "工作单位"
        ],
        "information": {
            "人物": [
                "性别",
                "出生日期",
                "年龄",
                "职务",
                "电话",
                "邮箱",
                "学历"
            ],
            "学校": [
                "学历",
                "专业",
                "时间",
                "时间段"
            ],
            "工作单位": [
                "职务",
                "时间",
                "时间段"
            ]
        }
    },
    "result": {
        "ner": {
            "人物": [
                "宋慧元"
            ],
            "学校": [],
            "工作单位": [
                "易烽设计服务有限公司",
                "圣荣设计服务有限公司"
            ]
        },
        "information": {
            "宋慧元": {
                "性别": [],
                "出生日期": [
                    "2021.7",
                    "2019.7",
                    "2014.7"
                ],
                "年龄": [
                    "29岁"
                ],
                "职务": [
                    "平面设计师"
                ],
                "电话": [
                    "13912345678"
                ],
                "邮箱": [
                    "Yourname@163.com"
                ],
                "学历": [
                    "中专"
                ]
            },
            "易烽设计服务有限公司": {
                "职务": [
                    "平面设计师"
                ],
                "时间": [
                    "2021.7"
                ],
                "时间段": [
                    "2021.7–至今"
                ]
            },
            "圣荣设计服务有限公司": {
                "职务": [],
                "时间": [
                    "2014.7",
                    "2019.7"
                ],
                "时间段": [
                    "2014.7–2019.7"
                ]
            }
        }
    }
}