{
    "path": "data/dataset_CV/CV/71.docx",
    "text": "  赖俊军   求职意向：市场销售相关工作岗位 生日：1998.05.08 身高：180cm 地址：上海宝山 学历：本科 邮箱：123456@qq.com 电话：15888888888 教育背景 2016.9-2020.6                 上海交通大学              市场管理（本科） 主修课程：石油及天然气运输概要，新能源开发，管道运输案例分析，中国能源地理 在校活动：参与新疆阿克苏石油勘探计划，参与上海复旦大学石油新能源清洁化项目等 工作经历 2020.6-2021.6                 京美科技技术有限公司              销售 工作描述： 拥有一定的能源专业相关知识，能够更好地完成公司产品的推广与销售工作； 在职期间完成能源销售订单50余单，开拓渠道3家，维系稳定客户12家； 锻炼了销售的商务沟通能力，能够从营销的角度规划销售方案。 2021.6-至今                  明泽科技技术有限公司                市场部经理 工作描述： 拥有一定的能源专业相关知识，能够更好地完成公司产品的推广与销售工作； 在职期间完成能源销售订单50余单，开拓渠道3家，维系稳定客户12家； 锻炼了销售的商务沟通能力，能够从营销的角度规划销售方案。 技能证书 语言技能：英语CET6、日语、韩语 专业技能：熟悉Web、iOS和Androind开发、精通数据库、C++及Java 办公技能：熟练使用Office办公软件、Axure RP、Visio 自我介绍 工作积极认真，细心负责，熟练运用办公自动化软件，善于在工作中提出问题，发现问题、解决问题，有较强的分析能力；勤奋好学，踏实肯干，动手能力强，认真负责，有很强的社会责任感；坚毅不拔，吃苦耐劳，喜欢和善于迎接新挑战。 ",
    "token": {
        "ner": [
            "人物",
            "学校",
            "工作单位"
        ],
        "information": {
            "人物": [
                "性别",
                "出生日期",
                "年龄",
                "职务",
                "电话",
                "邮箱",
                "学历"
            ],
            "学校": [
                "学历",
                "专业",
                "时间",
                "时间段"
            ],
            "工作单位": [
                "职务",
                "时间",
                "时间段"
            ]
        }
    },
    "result": {
        "ner": {
            "人物": [
                "赖俊军"
            ],
            "学校": [
                "上海交通大学"
            ],
            "工作单位": [
                "京美科技技术有限公司",
                "明泽科技技术有限公司"
            ]
        },
        "information": {
            "赖俊军": {
                "性别": [],
                "出生日期": [
                    "1998.05.08"
                ],
                "年龄": [
                    "1998.05.08"
                ],
                "职务": [
                    "市场销售相关工作岗位"
                ],
                "电话": [
                    "15888888888"
                ],
                "邮箱": [
                    "123456@qq.com"
                ],
                "学历": [
                    "本科"
                ]
            },
            "上海交通大学": {
                "学历": [
                    "本科",
                    "本科"
                ],
                "专业": [
                    "市场管理"
                ],
                "时间": [
                    "2016.9",
                    "2020.6"
                ],
                "时间段": [
                    "2016.9-2020.6"
                ]
            },
            "京美科技技术有限公司": {
                "职务": [
                    "销售"
                ],
                "时间": [
                    "2020.6",
                    "2020.6",
                    "2021.6"
                ],
                "时间段": [
                    "2020.6-2021.6",
                    "2021.6-至今"
                ]
            },
            "明泽科技技术有限公司": {
                "职务": [
                    "市场部经理"
                ],
                "时间": [
                    "2020.6",
                    "2021.6"
                ],
                "时间段": [
                    "2021.6-至今"
                ]
            }
        }
    }
}