{
    "path": "data/dataset_CV/CV/77.docx",
    "text": "                个人简历 RESUME 袁哲仪       南开大学  137 0000 8888 500d@139.com   袁哲仪 市场拓展/策划专员         关于我ABOUT ME 技能水平SKILLS 有丰富的营销知识体系做基础；对于市场营销方面的前沿和动向有一定的 了解，善于分析和吸取经验；熟悉网络推广，尤其是社会化媒体方面，有独ADOBE PHOTOSHOP 到的见解和经验；个性开朗，容易相处，团队荣誉感强。   MICROSOFT WORD 本人31岁，有8年以上丰富的营销知识体系做基础；对于市场营销方面的 前沿有的了解，善于分析和吸取经验； MICROSOFT POWERPOINT 个性开朗，容易相处，团队荣誉感强。     工作经验EXPERIENCE 教育背景EDUCATION 2015年9月-2017年9月  智云信息科技有限公司  运营推广 2011.9-2015.7      负责社会化媒体营销团队的搭建工作，制定相关运营策略和指标，带南开大学       市场营销（本科） 领团队实施计划； 网站常态运营活动规划和推进执行； 相关数据报基本会计、统计学、市场营销、国际市场营告和统计，为公司决策层提供决策依据； 销、市场调查与预测、商业心理学。   2017年9月-2020年9月 证书 杰艺信息科技有限公司  运营推广  CET-6，优秀的听说写能力 ⚫负责社会化媒体营销团队的搭建工作，制定相关运营策略和指标，带 计算机二级，熟悉计算机各项操作 ⚫领团队实施计划； 网站常态运营活动规划和推进执行； 相关数据报 高级营销员，国家职业资格四级 ⚫告和统计，为公司决策层提供决策依据   奖项 2020年9月-2023年2月  2013.10获国家奖学金 ⚫东宇信息科技有限公司  运营推广  2013.11获“三好学生称号” ⚫负责社会化媒体营销团队的搭建工作，制定相关运营策略和指标，带 2012.12创意营销大赛一等奖 ⚫领团队实施计划；  2012.4挑战杯创业计划大赛铜奖 ⚫    兴趣爱好INTEREST 优势特长EXPERTISE       篮球 / 登山 / 手工/ 电影 / 音乐 / 足球 / 演讲    写作     策划      摄影   尊敬的领导：    您好！   我是南开大学艺术系的一名学生，即将面临毕业。四年来，在师友的严格 教益及个人的努力下，我具备了扎实的专业基础知识，系统地掌握了等有关理论;熟悉 涉外工作常用礼仪;具备较好的英语听、说、读、写、译等能力;能熟练操作计算机办公 软件。同时，我利用课余时间广泛地涉猎了大量书籍，不但充实了自己，也培养了自 己多方面的技能。 此外，我还积极地参加各种社会活动，抓住每一个机会，锻炼自己。大学四年，我 深深地感受到，与优秀学生共事，使我在竞争中获益;向实际困难挑战，让我在挫折中 成长。我热爱贵单位所从事的事业，殷切地期望能够在您的领导下，为这一光荣的事业 添砖加瓦;并且在实践中不断学习、进步。随信附上个人求职简历，收笔之际，郑重地提 一个小小的要求：无论您是否选择我，尊敬的领导，希望您能够接受我诚恳的谢意!           此外，我还积极地参加各种社会活动，抓住每一个机会，锻炼自己。大学四年，我 深深地感受到，与优秀学生共事，使我在竞争中获益;向实际困难挑战，让我在挫折中 成长。我热爱贵单位所从事的事业，殷切地期望能够在您的领导下，为这一光荣的事业 添砖加瓦;并且在实践中不断学习、进步。随信附上个人求职简历，收笔之际，郑重地提 一个小小的要求：无论您是否选择我，尊敬的领导，希望您能够接受我诚恳的谢意!      此致  敬礼   申请人：袁哲仪 申请时间： 2015年05月          ",
    "token": {
        "ner": [
            "人物",
            "学校",
            "工作单位"
        ],
        "information": {
            "人物": [
                "性别",
                "出生日期",
                "年龄",
                "职务",
                "电话",
                "邮箱",
                "学历"
            ],
            "学校": [
                "学历",
                "专业",
                "时间",
                "时间段"
            ],
            "工作单位": [
                "职务",
                "时间",
                "时间段"
            ]
        }
    },
    "result": {
        "ner": {
            "人物": [
                "袁哲仪"
            ],
            "学校": [
                "南开大学"
            ],
            "工作单位": [
                "智云信息科技有限公司",
                "杰艺信息科技有限公司"
            ]
        },
        "information": {
            "袁哲仪": {
                "性别": [],
                "出生日期": [
                    "2015年9月",
                    "2015年05月"
                ],
                "年龄": [
                    "31岁",
                    "2015年05月"
                ],
                "职务": [
                    "市场拓展/策划专员"
                ],
                "电话": [],
                "邮箱": [],
                "学历": [
                    "本科",
                    "大学"
                ]
            },
            "南开大学": {
                "学历": [
                    "本科"
                ],
                "专业": [
                    "市场营销",
                    "艺术系"
                ],
                "时间": [
                    "2017年9月",
                    "2015年9月",
                    "2020年9月",
                    "2012.4",
                    "2013.11",
                    "2012.12"
                ],
                "时间段": [
                    "2015年9月-2017年9月",
                    "2017年9月-2020年9月",
                    "2011.9-2015.7"
                ]
            },
            "智云信息科技有限公司": {
                "职务": [
                    "运营推广"
                ],
                "时间": [
                    "2015年9月",
                    "2017年9月",
                    "2011.9",
                    "2015.7"
                ],
                "时间段": [
                    "2015年9月-2017年9月",
                    "2011.9-2015.7"
                ]
            },
            "杰艺信息科技有限公司": {
                "职务": [
                    "运营推广"
                ],
                "时间": [
                    "2020年9月",
                    "2017年9月"
                ],
                "时间段": [
                    "2017年9月-2020年9月"
                ]
            }
        }
    }
}