{
    "path": "data/dataset_CV/CV/82.docx",
    "text": "李 伦 圣 简 历 艺术设计          100% 对工作的热忱与激情 期待您的反馈 个 人 简 介      李伦圣  这里描述关于你的任职细节，描述的内容可以让潜在的雇主知道他们为什么需要雇佣你。介绍一些职业生涯的亮点，合作过的业内著26岁 名人事或参与的项目介绍  教育 经 验 2017-2021   厦门大学       本科  工 作 经 验  需要描述的住宅地址 2022.7至今 家庭住址 林利全屋定制 | 设计总监 就是在这个公司任职时所担任职位工作经历等等这个公司任职时所担任职位工作经历等等这个公司任职时所担任职位工作经历 2021.7- 2022.7 电话 12345XXXXXX 力恒 | 艺术总监 就是在这个公司任职时所担任职位工作经历等等这个公司任职时所担任职位工作经历等等这个公司任职时所担任职位工作经历  邮箱 12345@docer.com                 自荐信 尊敬的领导 ： 您好!  艺术设计首先，对于您能在百忙之中抽出时间来翻阅我的资料，我表示由衷 的感谢。正如您所见的，我的简历做得很简单，因为我知道，您能 翻阅我的资料的时间并不会太多，所以，一切就长话短说了。 我是一个应届即将毕业的毕业生，和所有的毕业生一样，在面临毕 业之际我们都被分配到嘉瑞集团进行实习，现在实习均已结束。所需要描述的住宅地址 以需要正式踏足社会寻找工作。我有一定的策划组织协调能力。并 家庭住址 且为人诚实，责任心强，乐观且积极向上，能吃苦耐劳，学习领悟和适应能力也都不错。这些都是我的长处。只是初出茅庐，需要经受社会的洗礼，承受生活的考验，更需要一个机会来锻炼。 正好，在这个时候，我看到了贵公司的招聘。我觉得我应该来试试。贵公司近年来所取得的成果，另人瞩目。而贵公司所提及的岗电话 12345XXXXXX 位，坦白的讲，说我能完全胜任，不免有些心虚。但对我而言，这是一个机会，我相信我能通过不断的学习去适应并干好来。这是一个可以让我得以锻炼并不断成长的机会，更是一个能让我为之奋斗的机会，而我更相信，给我这个机会，我的成长，我的努力，更将给贵公司带去新的活力。我真诚地希望能加盟贵公司，虚心学习，努力工作，尽心尽力，为公司的发展，竭尽我绵薄之力。真切希望邮箱 12345@docer.com 能给我这个机会。  此致 李伦圣  2020年5月26日  ",
    "token": {
        "ner": [
            "人物",
            "学校",
            "工作单位"
        ],
        "information": {
            "人物": [
                "性别",
                "出生日期",
                "年龄",
                "职务",
                "电话",
                "邮箱",
                "学历"
            ],
            "学校": [
                "学历",
                "专业",
                "时间",
                "时间段"
            ],
            "工作单位": [
                "职务",
                "时间",
                "时间段"
            ]
        }
    },
    "result": {
        "ner": {
            "人物": [
                "李伦圣"
            ],
            "学校": [
                "厦门大学"
            ],
            "工作单位": [
                "嘉瑞集团"
            ]
        },
        "information": {
            "李伦圣": {
                "性别": [],
                "出生日期": [
                    "2022.7",
                    "2020年5月26日"
                ],
                "年龄": [
                    "26岁",
                    "2020年5月26日"
                ],
                "职务": [],
                "电话": [
                    "12345XXXXXX",
                    "12345XXXXXX位",
                    "345XXXXXX位"
                ],
                "邮箱": [
                    "12345@docer.com"
                ],
                "学历": [
                    "本科"
                ]
            },
            "厦门大学": {
                "学历": [
                    "本科"
                ],
                "专业": [
                    "艺术设计"
                ],
                "时间": [
                    "2022.7",
                    "2017"
                ],
                "时间段": [
                    "2017-2021"
                ]
            },
            "嘉瑞集团": {
                "职务": [],
                "时间": [
                    "2020年5月26日"
                ],
                "时间段": []
            }
        }
    }
}