{
    "path": "data/dataset_CV/CV/83.docx",
    "text": "PERSON RESUME  简历 个人姓名：彭正仁 毕业院校：华中科技大学 联系电话：12345678901 电子邮箱：1234567@qq.com 基本资料 求职意向：产品开发 姓名：彭正仁   身高：180CM 出生：1999.10 政治面貌：党员 民族：汉族 邮箱：12498118@qq.com 电话：1111111111 荣誉奖励 籍贯：广东省韶关市 地址：广东省广州市天河 教育背景 2017.09—2021.06                华中科技大学           管理与信息系统专业             本科 专业课程：微观经济学、宏观经济学、会计学、市场营销学、管理学、统计学、运筹学、组织战略与行会计学、市场营销学、管理学、统计学、运筹学、组织战略与行为等  实习经历 2022.7—至今                          广州俊松信息科技公司                   职位：互联网运营 工作描述： 扩大用户群，提高用户活跃度。改进产品体验，寻找合适的盈利模式增加收入。进行市场调研，收集用户需求。负责或指导产品运营。寻找合适的盈利模式增加收入。进行市场调研，收集用户需求。 2021.7—2022.7                         广州天亿信息科技公司                   职位：互联网运营 工作描述： 扩大用户群，提高用户活跃度。改进产品体验，寻找合适的盈利模式增加收入。进行市场调研，收集用户需求。负责或指导产品运营。寻找合适的盈利模式增加收入。进行市场调研，收集用户需求。 校内经历 2017.09-2018.06                            校学生会                 职位：干事 工作描述： 协助辅导员完成各项日常工作事务，组织学院活动、联系各类负责人，做好奖助贷等相关评选工作 2018.09-2021.06                            校学生会                 职位：主席 工作描述： 协助辅导员完成各项日常工作事务，组织学院活动、联系各类负责人，做好奖助贷等相关评选工作  荣誉奖励  全国大学生英语四六级考试                    全国大学生计算机程序设计比赛湖北赛区一等奖 湖北校园十大歌手第一名                      全国大学生科学知识竞赛比赛湖北赛区一等奖 自我评价 为人诚恳，乐观开朗，富拼搏精神，能吃苦耐劳。工作积极主动、认真踏实，有强烈的责任心和团队精神，有较强的学习能力。对事物有敏锐的洞察力以及具有较强的应变处理能力和适应能力；对工作努力热情、敬业负责。对事物有敏锐的洞察力以及具有较强的应变处理能力和适应能力。 自荐信   尊敬的领导，您好：     古有毛遂自荐，今有伯乐点将。愿借您伯乐慧眼，开始我千里之行。       “ 疾风知劲草，路遥知马力”。简单几页纸只是我的“包装”和“广告”，“产品”自身的“质量”和“性能”有待于您通过“使用”来证明。谢谢您在百忙之中垂阅我的自荐书。         2年的工作经历让我具有较强的组织能力和社交能力，能很好地独立开展工作，并与其他人协手合作，发扬团队精神，在各项工作中均获得广泛的好评。我在思想上要求进步，努力培养思想道德素质，提高自身修养，多次获得同事以及领导的赞扬。“服务社会”是我的职责，“敬业”是我的人生信条，“年轻”、“可塑性强”是我的资本。“稳重”、“勤奋”、“认真”以及“力求上进”是我的个人特点。        天行健，君子以自强不息。事业上的成功需要知识、毅力、汗水、机会的完美结合。同样，一个单位的荣誉更需要员工们的无私奉献。     我恳请贵单位给我一个机会，让我成为你们中的一员，我将以无比的热情和勤奋的工作回报您的知遇之恩，并非常乐意与未来的同事合作，为我们共同的事业奉献全部的真诚的才智！                                                                                          自荐人：彭正仁                                                            时间：2023年4月 ",
    "token": {
        "ner": [
            "人物",
            "学校",
            "工作单位"
        ],
        "information": {
            "人物": [
                "性别",
                "出生日期",
                "年龄",
                "职务",
                "电话",
                "邮箱",
                "学历"
            ],
            "学校": [
                "学历",
                "专业",
                "时间",
                "时间段"
            ],
            "工作单位": [
                "职务",
                "时间",
                "时间段"
            ]
        }
    },
    "result": {
        "ner": {
            "人物": [
                "彭正仁"
            ],
            "学校": [
                "华中科技大学"
            ],
            "工作单位": [
                "广州俊松信息科技公司",
                "广州天亿信息科技公司",
                "校学生会"
            ]
        },
        "information": {
            "彭正仁": {
                "性别": [],
                "出生日期": [
                    "1999.10",
                    "2023年4月"
                ],
                "年龄": [
                    "1999.10",
                    "2023年4月"
                ],
                "职务": [
                    "互联网运营"
                ],
                "电话": [
                    "1111111111",
                    "12345678901"
                ],
                "邮箱": [
                    "12498118@qq.com",
                    "1234567@qq.com"
                ],
                "学历": [
                    "本科"
                ]
            },
            "华中科技大学": {
                "学历": [
                    "本科"
                ],
                "专业": [
                    "管理与信息系统专业"
                ],
                "时间": [
                    "2017.09",
                    "2021.06",
                    "1999.10"
                ],
                "时间段": [
                    "2017.09—2021.06",
                    "2022.7—至今"
                ]
            },
            "广州俊松信息科技公司": {
                "职务": [
                    "互联网运营"
                ],
                "时间": [
                    "2022.7"
                ],
                "时间段": [
                    "2022.7—至今"
                ]
            },
            "广州天亿信息科技公司": {
                "职务": [
                    "互联网运营"
                ],
                "时间": [
                    "2022.7",
                    "2021.7"
                ],
                "时间段": [
                    "2021.7—2022.7"
                ]
            },
            "校学生会": {
                "职务": [
                    "主席"
                ],
                "时间": [
                    "2018.09",
                    "2021.06"
                ],
                "时间段": [
                    "2018.09-2021.06"
                ]
            }
        }
    }
}