{
    "path": "data/dataset_CV/CV/86.docx",
    "text": "  个人简历/RESUME 刘佳雨 求职意向：产品设计 +1888888888  888888@163.com  上海   刘佳雨   乐观 做事很靠谱 奋斗ing 要么不做，要做就做到最好 求职意向 意向岗位 职业类型 意向城市 薪资要求  入职时间 30岁 教育背景 陕西西安 2011.9-2014.6         陕西工业职业技术学院         工商管理 18091898568 主修课程： 管理学、经济学、管理信息系统、信息经济学、信息检索、计算机开发技术、数据库原理与应用、应用统计学等。 53555893@qq.com 工作经验 技能特长 2017.7-2022.9 世程文化发展有限公司      市场助理      负责日常管理本小组内日常运营、业务管理以及上传下达 ⚫ 负责组内员工的日常沟通和各项KPI的提升； ⚫photoshop  每月做一次自己管理的员工团队业务分析以及发展动向； 良好 ⚫ 英语 精通 2014.7-2017.7 利亚科技业务部客服中心      客服组长     办公软件  积极参与学生会各项活动，领导其他干事一起参与各类学生活动策划； ⚫熟练  负责学院活动的赞助拉取，制作活动赞助方案，并上门拜访企业拉取赞⚫word 助，建立良好的合作关系； 精通  负责院刊的策划编辑工作，统筹小部分任务。 ⚫ 完成领导布置的其他任务。 ⚫兴趣爱好 奖项荣誉 2003.10 获国家奖学金 2013.11 获“三好学生称号” 阅读 骑行 2012.12 华南大学生创意营销大赛一等奖 2012.04 挑战杯创业计划大赛省级铜奖 旅游 唱歌 自我评价 本人性格开朗、活泼，做事认真负责，喜欢挑战，具有良好的沟通能力和团队精神。 羽毛球 电影  尊敬的领导：    您好！   我是陕西工业职业技术学院的一名学生，即将面临毕业。三年来，在师友的严格 教益及个人的努力下，我具备了扎实的专业基础知识，系统地掌握了等有关理论;熟悉 涉外工作常用礼仪;具备较好的英语听、说、读、写、译等能力;能熟练操作计算机办公 软件。同时，我利用课余时间广泛地涉猎了大量书籍，不但充实了自己，也培养了自 己多方面的技能。        此外，我还积极地参加各种社会活动，抓住每一个机会，锻炼自己。大学三年，我 深深地感受到，与优秀学生共事，使我在竞争中获益;向实际困难挑战，让我在挫折中 成长。我热爱贵单位所从事的事业，殷切地期望能够在您的领导下，为这一光荣的事业 添砖加瓦;并且在实践中不断学习、进步。随信附上个人求职简历，收笔之际，郑重地提 一个小小的要求：无论您是否选择我，尊敬的领导，希望您能够接受我诚恳的谢意!     此外，我还积极地参加各种社会活动，抓住每一个机会，锻炼自己。大学三年，我 深深地感受到，与优秀学生共事，使我在竞争中获益;向实际困难挑战，让我在挫折中 成长。我热爱贵单位所从事的事业，殷切地期望能够在您的领导下，为这一光荣的事业 添砖加瓦;并且在实践中不断学习、进步。随信附上个人求职简历，收笔之际，郑重地提 一个小小的要求：无论您是否选择我，尊敬的领导，希望您能够接受我诚恳的谢意!     此外，我还积极地参加各种社会活动，抓住每一个机会，锻炼自己。大学三年，我 深深地感受到，与优秀学生共事，使我在竞争中获益;向实际困难挑战，让我在挫折中 成长。我热爱贵单位所从事的事业，殷切地期望能够在您的领导下，为这一光荣的事业 添砖加瓦;并且在实践中不断学习、进步。随信附上个人求职简历，收笔之际，郑重地提 一个小小的要求：无论您是否选择我，尊敬的领导，希望您能够接受我诚恳的谢意!   此致  敬礼   申请人：刘佳雨 申请时间： 2014年05月          ",
    "token": {
        "ner": [
            "人物",
            "学校",
            "工作单位"
        ],
        "information": {
            "人物": [
                "性别",
                "出生日期",
                "年龄",
                "职务",
                "电话",
                "邮箱",
                "学历"
            ],
            "学校": [
                "学历",
                "专业",
                "时间",
                "时间段"
            ],
            "工作单位": [
                "职务",
                "时间",
                "时间段"
            ]
        }
    },
    "result": {
        "ner": {
            "人物": [
                "刘佳雨"
            ],
            "学校": [
                "陕西工业职业技术学院",
                "职业技术学院"
            ],
            "工作单位": [
                "世程文化发展有限公司"
            ]
        },
        "information": {
            "刘佳雨": {
                "性别": [],
                "出生日期": [
                    "2011.9",
                    "2014年05月"
                ],
                "年龄": [
                    "30岁",
                    "2014年05月"
                ],
                "职务": [
                    "产品设计",
                    "市场助理"
                ],
                "电话": [
                    "18091898568"
                ],
                "邮箱": [],
                "学历": []
            },
            "陕西工业职业技术学院": {
                "学历": [],
                "专业": [
                    "工商管理"
                ],
                "时间": [
                    "2011.9",
                    "2014.6",
                    "2017.7",
                    "2022.9",
                    "2003.10"
                ],
                "时间段": [
                    "2011.9-2014.6",
                    "2017.7-2022.9"
                ]
            },
            "世程文化发展有限公司": {
                "职务": [
                    "市场助理"
                ],
                "时间": [
                    "2017.7",
                    "2022.9"
                ],
                "时间段": [
                    "2017.7-2022.9"
                ]
            },
            "职业技术学院": {
                "学历": [],
                "专业": [],
                "时间": [],
                "时间段": [
                    "三年来"
                ]
            }
        }
    }
}