{
    "path": "data/dataset_CV/CV/92.docx",
    "text": "13912220080 沈慧美 myemail@163.com  求职意向：设计师 上海，浦东 校 园 活 动 姓    名：沈慧美  大二期间担任系学生会生活部部长，锻炼了自己的组织协调能年    龄：30岁 力；请直接修改为自己的内容。 籍    贯：上海  大一、大二期间担任校市场研究会干事，参与组织多次研讨会；请直接修改为自己的内容。 民    族：汉族  大三期间担任学生会生活部部长，组织多次校园活动，都取得政治面貌：中共党员 了不错的效果；请直接修改为自己的内容。 健康状况：良好 利用大二署假参加学校组织的“三下乡”活动，加深了对社会的 了解。请直接修改为自己的内容。 工 作 经 验 2019年8月-2022年7月 世鑫设计公司  ⚫设计师 上海 2012-2016 2017年8月-2019年8月 慧瀚翻译公司  ⚫上海海洋大学 翻译 上海 设计专业 2016年8月-2017年8旭才百货公司  ⚫月 上海 本   科 产品宣传 荣 誉 奖 项 2016年国家励志一等奖学金 2015年电子科技大学挑战主持人大赛第一名  2015年全国大学生数学建模大赛国家二等奖  MS Office 2014年领导英语俱乐部获得“某年度十佳社团”荣誉称号 2014年电子科技大学第九届数学建模大赛一等奖 Photoshop 2013年参加省红十字协会演讲比赛并取得前三名 Illustrator 自 我 评 价 英  语  独立负责过大型项目，非常成功的规划了项目 A 工作； 日  语  具备艺术家的灵感创作能力，公司公认的首席 PPT 制作人；  非常优秀的用户心理洞察力，配合丰富的创意及文案能力。 粤  语  专业知识的学习以及多年的工作实践，使我积累了丰富的工作经验，并取得了优秀的销售业绩。段前间距设为0.2行。 ",
    "token": {
        "ner": [
            "人物",
            "学校",
            "工作单位"
        ],
        "information": {
            "人物": [
                "性别",
                "出生日期",
                "年龄",
                "职务",
                "电话",
                "邮箱",
                "学历"
            ],
            "学校": [
                "学历",
                "专业",
                "时间",
                "时间段"
            ],
            "工作单位": [
                "职务",
                "时间",
                "时间段"
            ]
        }
    },
    "result": {
        "ner": {
            "人物": [
                "沈慧美"
            ],
            "学校": [
                "上海海洋大学",
                "电子科技大学"
            ],
            "工作单位": [
                "世鑫设计公司",
                "慧瀚翻译公司",
                "英语俱乐部"
            ]
        },
        "information": {
            "沈慧美": {
                "性别": [],
                "出生日期": [
                    "13912220080"
                ],
                "年龄": [],
                "职务": [
                    "设计师"
                ],
                "电话": [
                    "13912220080"
                ],
                "邮箱": [
                    "myemail@163.com"
                ],
                "学历": [
                    "大二"
                ]
            },
            "世鑫设计公司": {
                "职务": [
                    "设计师"
                ],
                "时间": [
                    "2022年7月",
                    "2019年8月"
                ],
                "时间段": [
                    "2019年8月-2022年7月"
                ]
            },
            "上海海洋大学": {
                "学历": [],
                "专业": [],
                "时间": [
                    "2017年8月",
                    "2019年8月"
                ],
                "时间段": [
                    "2019年8月-2022年7月",
                    "2017年8月-2019年8月"
                ]
            },
            "电子科技大学": {
                "学历": [],
                "专业": [],
                "时间": [
                    "2015年",
                    "2019年8月",
                    "2014年"
                ],
                "时间段": [
                    "2019年8月-2022年7月",
                    "2015年",
                    "2014年"
                ]
            },
            "慧瀚翻译公司": {
                "职务": [],
                "时间": [
                    "2017年8月"
                ],
                "时间段": [
                    "2017年8月-2019年8月"
                ]
            },
            "英语俱乐部": {
                "职务": [],
                "时间": [],
                "时间段": [
                    "4年"
                ]
            }
        }
    }
}