{
    "path": "data/dataset_CV/CV/97.docx",
    "text": " 教育背景 2019.09-2023.07    中央戏曲学院    广播电视编导   本科 实习经历 潘孝东 2021.09~2022.06     百度   编辑 在百度实习期间，在百度新闻网站发表新闻总计300余篇。 求职意向：编辑 2019.09~2022.09      校园网     记者 在校期间，担任校园网记者，报道发表近100篇校内校外新闻。 基本信息   校园经历 女  2001.12.18                            2019.12~2023.06   学生会团宣部   部长   北京通州        在担任团宣部部长期间，在校外新闻网站(四川新闻联播网，百姓生活网等)发➢ 138 9999 9999 表校内新闻70余篇，以及其它新闻总计200余篇。  2021.09~2023.03      学生会               女生部副部长 xiaohen@189.com  在担任女生部副部长期间，多次组织院内、校级素质拓展活动。 ➢2021.09~2022.06       学长导航员     在担任学长导航学期间，解决学妹学弟生活上和学习上的各种问题。经常组➢织班级进行课外活动。 个人技能 荣誉证书 Word  熟练 Excel  熟悉  优秀一等奖学金三次，二等奖学金两次，三等奖学金一次 ⚫ 全国计算机二级证书 ⚫PPT   熟悉  普通话二级甲等证书 ⚫  2023年度荣获\"优秀团员\"称号 ⚫ 2021~2022年度荣获\"创新创业\"奖  ⚫兴趣爱好 自我评价  电视编导专业，擅长写作，摄影，视频制作。 ⚫ 2年的新闻编辑实践经验，发表超过200余篇新闻文章。 ⚫ 学习能力强，专业成绩突出，多次获得奖学金。 ⚫    ",
    "token": {
        "ner": [
            "人物",
            "学校",
            "工作单位"
        ],
        "information": {
            "人物": [
                "性别",
                "出生日期",
                "年龄",
                "职务",
                "电话",
                "邮箱",
                "学历"
            ],
            "学校": [
                "学历",
                "专业",
                "时间",
                "时间段"
            ],
            "工作单位": [
                "职务",
                "时间",
                "时间段"
            ]
        }
    },
    "result": {
        "ner": {
            "人物": [
                "潘孝东"
            ],
            "学校": [
                "中央戏曲学院"
            ],
            "工作单位": [
                "团宣部"
            ]
        },
        "information": {
            "潘孝东": {
                "性别": [],
                "出生日期": [
                    "2001.12.18",
                    "2019.09"
                ],
                "年龄": [
                    "2001.12.18"
                ],
                "职务": [],
                "电话": [],
                "邮箱": [],
                "学历": [
                    "本科"
                ]
            },
            "中央戏曲学院": {
                "学历": [
                    "本科"
                ],
                "专业": [
                    "广播电视编导"
                ],
                "时间": [
                    "2019.09",
                    "2023.07"
                ],
                "时间段": [
                    "2019.09-2023.07"
                ]
            },
            "团宣部": {
                "职务": [
                    "部长"
                ],
                "时间": [
                    "2021.09"
                ],
                "时间段": [
                    "2021.09~2023.03"
                ]
            }
        }
    }
}